{
  "id": "char_andalu_001",
  "player_id": "player_001",
  "world_id": "inkglass_dark",
  "name": "Andalu",
  "level": 6,
  "specialisation_path_id": "scout",
  "ability_scores": {
    "strength":     10,
    "dexterity":    16,
    "constitution": 14,
    "intelligence": 12,
    "wisdom":       14,
    "charisma":     10
  },
  "skill_proficiencies": [
    "stealth", "perception", "survival", "athletics", "investigation"
  ],
  "saving_throw_proficiencies": ["strength", "dexterity"],
  "hp_current": 45,
  "hp_max": 45,
  "ac": 14,
  "passive_checks": {
    "perception":    15,
    "investigation": 14,
    "insight":       12
  },
  "conditions": [],
  "exhaustion_level": 0,
  "resources": {
    "hit_dice": { "current": 6, "max": 6 }
  },
  "wallet": {
    "inkglass_dark": 450
  },
  "inventory": [],
  "equipped_gear": {},
  "known_recipes": [],
  "companions": [],
  "rp_voice_notes": null,
  "relationships": {},
  "faction_standing": {
    "witches_circle":  20,
    "knights_moralis": -15
  },
  "created_at": "2026-05-03T00:00:00Z",
  "updated_at": "2026-05-03T00:00:00Z"
}
